{
  "$schema": "https://json-schema.org/draft/2020-12/schema",
  "$id": "https://github.com/St-John-Software/3d-models/blob/main/meta.schema.json",
  "title": "3D Model Project Metadata",
  "description": "Per-project metadata for 3D printable model collections.",
  "type": "object",
  "properties": {
    "description": {
      "type": "string",
      "description": "Human-readable project description."
    },
    "tags": {
      "type": "array",
      "items": { "type": "string" },
      "uniqueItems": true,
      "description": "Categories or tags for filtering (e.g. \"toy-parts\", \"organizer\")."
    },
    "version": {
      "type": "string",
      "pattern": "^\\d+\\.\\d+\\.\\d+$",
      "description": "Semver version string."
    },
    "license": {
      "type": "string",
      "description": "SPDX license identifier override (repo default is implied when absent)."
    },
    "difficulty": {
      "type": "string",
      "enum": ["beginner", "intermediate", "advanced"],
      "description": "Print difficulty rating."
    },
    "hardware": {
      "type": "array",
      "items": {
        "type": "object",
        "properties": {
          "item": { "type": "string", "description": "Hardware part name." },
          "quantity": { "type": "integer", "minimum": 1, "description": "Number required." },
          "notes": { "type": "string", "description": "Optional notes about this part." }
        },
        "required": ["item", "quantity"],
        "additionalProperties": false
      },
      "description": "Bill of materials for non-printed parts."
    },
    "printing_notes": {
      "type": "array",
      "items": { "type": "string", "minLength": 1, "maxLength": 500 },
      "minItems": 1,
      "maxItems": 20,
      "description": "Free-text printer/slicer guidance (layer height, seam placement, orientation, filament choice). One note per array entry."
    },
    "relatedModels": {
      "type": "array",
      "items": { "type": "string" },
      "uniqueItems": true,
      "description": "Directory names of related projects in this repo."
    },
    "mating_pairs": {
      "type": "array",
      "items": {
        "type": "array",
        "items": { "type": "string" },
        "minItems": 2,
        "maxItems": 2
      },
      "description": "Pairs of STL filenames (as rendered) that must fit together without geometric overlap."
    },
    "complex_interior": {
      "type": "boolean",
      "description": "Whether this model has significant interior cavities that a single isometric thumbnail cannot adequately convey. When true, CI renders additional orthographic views (top, bottom, front) alongside the standard isometric thumbnail."
    },
    "hero": {
      "type": "string",
      "pattern": "^[A-Za-z0-9._ -]+\\.stl$",
      "description": "Rendered STL basename (e.g. \"scanning_rig_assembly.stl\") to feature as this project's landing-gallery and README thumbnail. Defaults to the first STL alphabetically when absent."
    },
    "assembly": {
      "type": "object",
      "description": "Declares this project ships a composite preview: existing part STLs rendered together, each in a fixed colour. Replaces a monochrome merged-assembly STL for viewing.",
      "properties": {
        "stl": {
          "type": "string",
          "pattern": "^[A-Za-z0-9._ -]+\\.stl$",
          "description": "The rendered STL basename whose viewer card this composite replaces (e.g. \"assembly.stl\"). Basename only — no path separators or traversal segments."
        },
        "parts": {
          "type": "array",
          "minItems": 1,
          "items": {
            "type": "object",
            "properties": {
              "stl": {
                "type": "string",
                "pattern": "^[A-Za-z0-9._ -]+\\.stl$",
                "description": "Rendered STL basename of this part. Basename only — no path separators or traversal segments."
              },
              "color": { "type": "string", "pattern": "^#[0-9a-fA-F]{6}$" }
            },
            "required": ["stl", "color"],
            "additionalProperties": false
          }
        }
      },
      "required": ["stl", "parts"],
      "additionalProperties": false
    },
    "render_memory_gb": {
      "type": "object",
      "description": "Peak memory in GB a renderable needs for its full STL render, keyed by renderable basename without .scad (e.g. {\"terrain\": 12}). CI defers a marked cache miss to the render-heavy workflow (a ram-12g runner) when it exceeds the runner's RUNNER_JOB_MEMORY_GB (docs/ci-pipeline.md, \"Heavy renders\").",
      "patternProperties": {
        "^[A-Za-z0-9._ -]+$": { "type": "number", "minimum": 1 }
      },
      "additionalProperties": false
    }
  },
  "required": ["description"],
  "additionalProperties": false
}
