{
  "description": "Toe-operated pull for a pull-out kitchen bin. A Z-shaped bracket screws to the inside face of the drawer front, wraps its bottom edge, and drops a short recessed lip at floor level so a toe hooked behind it opens the bin with no hands. The base stops short of the front face, keeping the lip tucked back rather than flush.",
  "tags": ["kitchen", "household", "accessibility"],
  "version": "2.0.0",
  "difficulty": "intermediate",
  "hardware": [
    { "item": "4 x 16 mm countersunk wood screw", "quantity": 4, "notes": "Driven from inside the drawer through the fixing plate into the panel's back face in a 2 x 2 pattern, with rows 20mm and 50mm above the drawer bottom. 16mm is deliberate: 4mm of it is plate, leaving 12mm in a 22mm panel with no risk of breaking through the painted front." }
  ],
  "printing_notes": [
    "Print exactly as exported, standing on the profile face with the bracket's width vertical. Every face is then a vertical wall, so no supports are needed anywhere and the layers run across the bending load at the lip root rather than along it.",
    "This is a tall, narrow print, so use a larger brim and print it on its own. The default geometry is 120mm tall on a 19 x 66mm footprint, which is stable enough but not forgiving of bed adhesion problems.",
    "Slow outer-wall and travel moves once the print is up around mid-height so toolhead inertia is less likely to knock it over.",
    "4 perimeters and 40% infill. This part takes a repeated pulling load from a foot.",
    "The four screw holes are bored across the layers in a 2 x 2 pattern, so each has a 4.5mm bridge over it. Slow the bridging speed if your printer struggles; the holes are through-holes and clean up with a 4.5mm drill if needed.",
    "Measure the drawer front before printing: base_run is 15mm by default, which keeps the lip recessed behind the front face. It must not exceed the actual panel thickness, or the base will stand proud at the front edge.",
    "Check there is clearance behind the panel's bottom edge for the fixing plate - it stands 4mm into the drawer by default - and that the plinth is recessed far enough that a toe fits behind the lip.",
    "For a no-drilling installation set screw_holes to false and bond the flat inner face of the fixing plate to the panel with VHB tape."
  ]
}
