{
  "description": "Housing for the busy board PCB v3.0 by default (factory assembled by JLCPCB; 210 x 222 mm, 235.6 x 247.6 mm outside), or v2.0 with board_v3 off (222 mm square, 247.6 mm square outside), with a clear front: the board is seen through a 3 mm clear polycarbonate plate, cut from a DXF the build exports, held in a black printed frame whose rounded lip covers the plate's cut edge. The plate carries five 24 mm arcade buttons (v2: six), three panel pots, an EC11-style encoder, three APEM toggles, a slide switch and a small-hole buzzer grille, and has no other openings. A black back tray holds the board on standoffs 15 mm behind the plate and a screwed compartment for the three-cell 14500 LiFePO4 pack, its PCM and the CR-TL24 charger, whose USB-C socket sits recessed in the left wall; a screwed battery door closes it. No fixing or solder joint is reachable from the play side.",
  "hero": "busy_board_frame.stl",
  "tags": ["electronics", "enclosure", "toy", "child-safe"],
  "version": "0.5.0",
  "difficulty": "intermediate",
  "complex_interior": true,
  "relatedModels": ["ha-carlink-enclosure", "heating-controller-box"],
  "hardware": [
    { "item": "Busy board PCB v3.0, 210 x 222 mm (factory assembled by JLCPCB), or v2.0 with board_v3 off", "quantity": 1, "notes": "St-John-Software/electronics, hardware/busy-board-v3/ (v3.0, the default) or hardware/busy-board/ (v2.0, 222 mm square); dimensions from docs/busy-board-v3/PCB.md and docs/busy-board/PCB.md" },
    { "item": "3 mm clear polycarbonate sheet, cut to busy_board_plate.dxf", "quantity": 1, "notes": "213.4 x 225.4 mm for v3 (v2: 225.4 mm square), R3 corners; polycarbonate, not acrylic (acrylic cracks and shatters). Routed and drilled by a UK cut-to-size service (no laser: it yellows and stresses PC), holes down to 1.5 mm; protective film both sides. DXF: https://www.bstjohn.net/3d-models/busy_board_plate.dxf" },
    { "item": "24 mm arcade button, panel-nut type", "quantity": 5, "notes": "Four play buttons and the power button (v2: six, five play); held by its own panel nut, no push-on cap" },
    { "item": "10k linear panel pot, 17 mm RK163 with anti-rotation tab", "quantity": 3, "notes": "Switch Electronics 133042 (mono, solder lugs) or in-stock fallback 133085 (RK163G stereo, PCB pins, one gang wired); M7 x 0.75 bushing, 7 mm cut-out (pot_hole_d)" },
    { "item": "20 mm rotary encoder with push switch, panel-mount (bushing and nut)", "quantity": 1, "notes": "Switch Electronics 482026 (MPN 483363), 24 detents, M7 x 0.5 bushing, 7 mm cut-out (enc_hole_d)" },
    { "item": "APEM 5636A On-On toggle switch", "quantity": 3, "notes": "Switch Electronics 486015; 1/4-40 UNS bushing, 6.5 mm cut-out (tgl_hole_d); fixed metal lever, no sealing boot or lever cap" },
    { "item": "APEM U215 locking washer", "quantity": 3, "notes": "Switch Electronics 490906 (MOQ 10); its tab goes through the plate's tab hole (tgl_lug_r, tgl_lug_d)" },
    { "item": "On-On slide switch with two screw ears", "quantity": 1, "notes": "Switch Electronics 124002 (MOQ 10); ears 19 mm apart (slide_screw_pitch); actuator part of the switch" },
    { "item": "CLIFF K15 knob, set-screw fixing, 20 mm", "quantity": 4, "notes": "Switch Electronics 484151 (MPN CL172962); on the pots and the encoder; no push-on knobs" },
    { "item": "14500 (AA-format) cell holder with leads, no clip-on cover", "quantity": 3, "notes": "Side by side in the compartment, wired in parallel" },
    { "item": "IFR14500 LiFePO4 cell", "quantity": 3, "notes": "1S3P pack, matched within 50 mV before paralleling; never user-removable" },
    { "item": "1S LiFePO4 protection board (PCM)", "quantity": 1, "notes": "Between the cells and J1, on foam tape in the tray's PCM pocket" },
    { "item": "CR-TL24 1S LiFePO4 USB-C charger module", "quantity": 1, "notes": "In the cradle behind the left-wall plug pocket, component side down" },
    { "item": "M3 heat-set insert (4.6 mm OD, up to 6 mm long)", "quantity": 17, "notes": "Eight frame posts, eight tray PCB posts, one door boss; set insert_hole_d to 2.6 for self-tapping screws instead" },
    { "item": "M3 x 15 M-F nylon hex standoff (6 mm male thread)", "quantity": 8, "notes": "Through board holes H1-H8 into the tray's PCB posts; their tops press the plate into the frame lip and set the board 15 mm behind it (standoff_l == pcb_to_panel)" },
    { "item": "M3 x 10 countersunk screw", "quantity": 8, "notes": "Through the tray floor into the panel posts" },
    { "item": "M3 x 8 countersunk screw", "quantity": 1, "notes": "Battery door" },
    { "item": "M2 x 10 pan-head screw", "quantity": 2, "notes": "Slide switch: from the play side through the plate, a spacer and the switch's ears" },
    { "item": "M2 spacer, 2 mm long", "quantity": 2, "notes": "Between the plate and each slide-switch ear (slide_spacer_h)" },
    { "item": "M2 nyloc nut", "quantity": 2, "notes": "Behind each slide-switch ear, so the screws cannot work loose" }
  ],
  "printing_notes": [
    "Print the frame, tray and door in matte black PETG or ASA, 3 perimeters, without supports: the frame play face down with a brim, the tray floor down, the door outer face down. Frame and tray are 235.6 x 247.6 mm (v2: 247.6 mm square) and need a 250 mm bed (A1). The clear plate is not printed: its STL is for viewing only.",
    "Have the 3 mm clear polycarbonate plate (not acrylic) routed and drilled from https://www.bstjohn.net/3d-models/busy_board_plate.dxf, which the build exports from the OpenSCAD model and draws as seen from the play side. Its only openings are the control, tab, slide-switch and grille holes; keep the protective film on until assembly.",
    "Press the seventeen M3 heat-set inserts before assembly: eight in the frame posts, eight in the tray's PCB posts, one in the door boss.",
    "Assembly order: screw the eight M3 x 15 standoffs through H1-H8 into the tray's PCB posts, which seats the board; fit the buttons, pots, encoder and toggles to the plate with their panel nuts (tabs in their holes), the slide switch with two M2 x 10 screws, 2 mm spacers and nylocs, then the set-screw knobs; drop the plate into the frame's rebate; plug each control lead into the connector beside its cut-out; close up.",
    "The two slide-switch pan-head screws are the one approved play-side fastener besides the control nuts; their nylocs keep them captive. Every other fixing is behind the plate or under the tray.",
    "Tray, by an adult: hot-glue the CR-TL24 into its cradle component side down, sliding it toward the left wall until its USB-C socket passes the pocket's end wall and its charge LEDs sit over the two floor windows. Stick the PCM into its pocket on foam tape. Parallel the three matched cells in their holders, wire them through the PCM to J1 and the charger, and seat the holders in the compartment from the back with the leads through the -X notch.",
    "Close up: frame onto the tray with eight M3 x 10 countersunk screws from the back, which presses the plate onto the standoffs, then the battery door with its M3 x 8. The door needs a screwdriver (adult-only access, cells are never user-removable); J9 is only reachable with the tray off. Charge from the recessed USB-C pocket in the left wall.",
    "The LEDs sit on the board with no spacers, 6.4 mm (v2) / 13.4 mm (v3) behind the clear plate, and no panel diffuses them: re-check their brightness on the bench (BENCH_BRINGUP steps 7.5 and 11.7) before the board goes to the child.",
    "Toggles: the 3 mm plate takes one nut (APEM allows 4 mm with one nut, 2.5 mm with two). Fit each APEM 5636A from behind with the U215 locking ring on its bushing, tab through its plate hole, then the switch's lockwasher and one 8 mm A/F nut on the play face.",
    "VERIFY with the parts in hand: the plate sits flat on the standoffs with no rattle; the control leads reach with the plate held over the board; slide_spacer_h and screw size (M2 assumed: slide_screw_l, slide_head_d, slide_nut_d; the build checks nut and screw clearance); tab holes (pot_lug_a, pot_lug_r, pot_lug_d, tgl_lug_r, tgl_lug_d, enc_lug); the cutting service's minimum hole (1.5 mm assumed) and that it accepts 64-sided polylines instead of CIRCLEs.",
    "VERIFY against the delivered parts and adjust: arcade button depth, nut and switch reach (button_depth, button_nut_d, button_switch_reach); the toggle face and depth (tgl_face_d, tgl_depth); and the pot and encoder depths (pot_depth, enc_depth).",
    "VERIFY the pack side too: cell holder size (batt_l, batt_w, batt_h); PCM size (pcm_l, pcm_w); the CR-TL24 outline, seat height and LED positions (chg_l, chg_w, chg_seat, chg_led) and its USB-C plug overmould (usb_pocket_d); and the JST-XH lead room (raising pcb_to_panel needs longer standoffs: standoff_l).",
    "wall, corner_r, edge_r, inner_d, insert_hole_d and lip_clear are shared by the frame and the tray, panel_t by the frame and the plate, and floor_t, batt_l, batt_w, door_t and door_clear by the tray and the door: set them identically on every part that exposes them."
  ]
}
